sentence1	sentence2	label
ধারণাগতভাবে ক্রিম স্কিমিং এর দুটি মৌলিক মাত্রা রয়েছে - পণ্য এবং ভূগোল।	পণ্য এবং ভূগোল হল ক্রিমের স্কিমিং কাজ।	neutral
আপনি জানেন এই মৌসুমে আর আমার মনে হয় আপনার পর্যায়ে আপনি তাদেরকে পরবর্তী ধাপে হারিয়ে ফেলেছেন যদি তারা সিদ্ধান্ত নেন যে অভিভাবক দলকে মনে করতে যে ব্রেভস ট্রিপল এ এর একজন লোককে স্মরণ করার সিদ্ধান্ত নেন তাহলে একজন ডাবল এ লোক তার জায়গায় যায় আর একজন এ লোক তার জায়গায় যায়	মানুষ যদি স্মরণ করতে পারে তাহলে আপনি নীচের স্তরে হারিয়ে যাবেন।	entailment
আমাদের মধ্যে একজন আপনার নির্দেশগুলো পুঙ্খানুপুঙ্খভাবে পালন করবে।	আমার দলের একজন সদস্য তোমার আদেশ পালন করবে খুবই নির্ভুলভাবে।	entailment
আপনি কিভাবে জানলেন? এই সব তাদের তথ্য আবার।	এই তথ্য তাদের।	entailment
হ্যাঁ আমি তোমাকে বলছি যদি তুমি কিছু টেনিস জুতার দাম দাও... ...তাহলে আমি বুঝতে পারছি কেন তারা ১০০ ডলারের রেঞ্জে উঠে যাচ্ছে	টেনিস জুতার দাম অনেক।	neutral
